,links,title,news
0,/india/crime/031020/assam-villagers-lynch-woman-over-witchcraft-also-kill-man-who-confronted-them.html,Assam villagers lynch woman over witchcraft; also kill man who confronted them,"Guwahati: In yet another incident of witch hunting, a woman was lynched by her neighbours and villagers on suspicion of practicing witchcraft in central Assam’s Karbi Anglong district. In addition, a man who confronted the villagers over their belief was also lynched. Police said that they have already arrested nine persons but six other accused involved in the incident on Wednesday night are still at large. Asserting that efforts are on to nab six others too, police said that incident took place in Rohimapur area under the Dokmoka police station of Karbi Anglong district. Villagers said that on Wednesday, at a post-death ritual for a deceased in the village, another woman -- a 50-year-old widow Ramawati Halua -- started to behave in an abnormal way to which the villagers alleged that she was practicing witchcraft. Pointing out that most of the villagers also held the woman responsible for recent deaths and spread of diseases, police said that a mob started beating her and attacked her with sharp weapons. When a 28-year-old educated young man of the village, Bijoy Gaur, accused them of being superstitious, he was attacked too. The angry mob lynched both of them to death, offered rituals to the local deity and tried to cremate the bodies in a nearby hill. Karbi Anglong’s Superintendent of Police Debojit Deori said that they came to know about the incident on Thursday morning as it happened on the intervening night of Wednesday and Thursday. “We went to the spot and collected mortal remains of the victims. We have also seized the sharp weapons used for the crime and have arrested nine people so far,” he said. It was under the Dokmoka police station jurisdiction that two young men were beaten to death by an angry mob in 2018 after it suspected them of being child-lifters. It is significant that there have been many attempts to check incident of witch hunting, a social evil that has plagued parts of the state for decades. In 2001, Assam police had introduced Project Prahari, a community project by the police against killing of women after branding them as witches. According to official records, till December 2019, a total of 107 persons have been killed in witch-hunting incidents in the state since 2011. The Assam Witch Hunting (Prohibition, Prevention and Protection) Act, which implements stringent punishment and fine for branding and killing people after branding them as “witches”, is in effect in the state since 2018. According to the law, witch-hunting is viewed as a cognisable, non-bailable and non-compoundable offence. It was passed by Assam Assembly in 2015 with provisions of jail term up to life imprisonment."
1,/world/americas/021020/donald-trump-first-lady-melania-test-positive-for-coronavirus.html,"Donald Trump, first lady Melania test positive for coronavirus","Washington: US President Donald Trump and first lady Melania have tested positive for the coronavirus, the president tweeted on Friday, a development that is likely to bring to standstill his hectic election campaign. ""Tonight, @FLOTUS and I tested positive for COVID-19. We will begin our quarantine and recovery process immediately. We will get through this TOGETHER! 74-year-old Trump tweeted. In a statement, Trump's physician Dr. Sean Conley said he received confirmation of the positive tests on Thursday evening. ""The President and First Lady are both well at this time, and they plan to remain at home within the White House during their convalescence,"" Conley said. ""The White House medical team and I will maintain a vigilant watch, and I appreciate the support provided by some of our country's greatest medical professionals and institutions,"" Conley said. Rest assured I expect the President to continue carrying out his duties without disruption while recovering, and I will keep you updated on any future developments, the physician added. Trump's positive report comes just hours after his senior aide Hope Hicks was tested COVID-19 positive. ""Hope Hicks, who has been working so hard without even taking a small break, has just tested positive for COVID-19. Terrible! The first lady and I are waiting for our test results. In the meantime, we will begin our quarantine process!,"" Trump earlier said in tweet. Hicks, 31, is the closest aid of the president to have tested positive with coronavirus. She had travelled with the president on Air Force One early this week. Trump, in an interview to Fox News, on Thursday night said he and the first lady spend a lot of time with her. In the middle of the election campaign, Trump has been travelling a lot in particular in the battleground States. The development is likely to bring to standstill his hectic campaign for the November 3 presidential election. In a statement, Judd Deere, the Deputy White House Press Secretary said that the President takes the health and safety of himself and everyone who works in support of him and the American people very seriously. ""White House Operations collaborates with the Physician to the President and the White House Military Office to ensure all plans and procedures incorporate current CDC guidance and best practices for limiting COVID-19 exposure to the greatest extent possible both on complex and when the President is travelling,"" Deere said earlier."
2,/india/all-india/021020/trinamul-minister-defends-10-al-qaeda-accused-calls-for-their-release.html,"Trinamul minister defends 10 Al Qaeda accused, calls for their release","Berhampore/Kolkata: West Bengal  minister of state (independent charge), mass education extension and library services, Siddiqullah Chowdhury, on Thursday called the ten persons who were arrested by the National Investigation Agency (NIA) recently from West Bengal and Kerala for their alleged link to a terror module of Al-Qaeda ""innocent."" Clearly defending them, he also demanded their release and blamed the NIA and the Narendra Modi government of defaming the Muslim community in the name of terrorism. Chowdhury, who is also the state president of Jamiat Ulema-e-Hind, is the first member of Chief Minister Mamata Banerjee's Cabinet to react against the central agency's crackdown. At Berhampore district library office in Murshidabad, he claimed, ""As far as my knowledge goes, all those who were arrested on the allegations of being terrorists of Al-Qaeda from Domkal and other places are totally innocent. Some of them had only read religious preacher Zakir Naik's books and pamphlets which is not a sin at all."" The family members of the ten accused were present with Chowdhury at the press meet. Expressing his solidarity with them, he alleged that the BJP government at the Centre and the NIA have been trying hard to tarnish the image of Muslims by linking them to terrorism. ""It is a dangerous ploy of central government,"" he added. Chowdhury even demanded that all those, who were arrested by the NIA, be freed because local clerics at the mosques have given them their certificate of innocence."
3,/sports/cricket/021020/virats-rcb-take-on-rajasthan-royals-in-first-afternoon-match-of-ipl-2020.html,Virat's Royal Challengers take on Rajasthan Royals in first afternoon match of IPL 2020,"Abu Dhabi: The dew factor will go out of the window but the searing heat will be an issue when Royal Challengers Bangalore take on a better prepared Rajasthan Royals in the first of the 10 IPL double-headers here on Saturday. Having played their first two games at Sharjah, the smallest of the three venues, Royals got their strategy wrong in the game against Kolkata Knight Riders in Dubai. The ground here too is on the bigger side and Royals' experience of playing in Dubai will help them take more informed decisions. RCB will also be making their first appearance at the Sheikh Zayed Cricket Stadium. With the batsmen unable to hit through the line as consistently as they could do in Sharjah, Royals failed to chase 175 against KKR on Wednesday. Since they have a settled overseas players' combination, one possible change in the eleven could be replacing pacer Ankit Rajpoot with Varun Aaron, who is yet to get a game. The team has benched young opener Yashasvi Jaiswal after Jos Buttler's arrival but calls have been growing for his inclusion. With the top three picking themselves, the stylish southpaw can only play in the middle order. Both Royals and the RCB go into Saturday's afternoon match with two wins in three games. RCB have made a promising start but need to improve their fielding and death bowling. Navdeep Saini bowled a tidy Super Over against Mumbai Indians to get his team over the line after RCB leaked as many as 79 runs in the last four overs for the game to be tied. The Bangalore franchise made three changes in the previous clash and are likely to give those players - Isuru Udana, Adam Zampa and Gurkeerat Mann - another go. The move to open the bowling with Washington Sundar paid off as the offie returned with figures of 12 for one in four overs in a game where more than 400 runs were scored. Ab de Villiers has shown ominous touch and it must be heartening for the team management to see Shivam Dube providing the big hits towards the end against Mumbai Indians. Skipper Kohli is yet to set the tournament on fire and Saturday could be his day. Squads: RCB: Virat Kohli (c), AB de Villiers, Parthiv Patel, Aaron Finch, Josh Philippe, Chris Morris, Moeen Ali, Mohammed Siraj, Shahbaz Ahmed, Devdutt Padikkal, Yuzvendra Chahal, Navdeep Saini, Dale Steyn, Pawan Negi, Isuru Udana, Shivam Dube, Umesh Yadav, Gurkeerat Singh Mann, Washington Sundar, Pavan Deshpande, Adam Zampa. RR: Jos Buttler, Ben Stokes, Sanju Samson, Andrew Tye, Kartik Tyagi, Steven Smith (c), Ankit Rajpoot, Shreyas Gopal, Rahul Tewatia, Jaydev Unadkat, Mayank Markande, Mahipal Lomror, Oshane Thomas, Riyan Parag, Yashasvi Jaiswal, Anuj Rawat, Akash Singh, David Miller, Manan Vohra, Shashank Singh, Varun Aaron, Tom Curran, Robin Uthappa, Aniruddha Joshi, Jofra Archer. Match starts 3.30 IST."
4,/india/all-india/021020/hathras-gangrape-allahabad-high-court-summons-up-officials-over-incident.html,Hathras gangrape: Allahabad High Court summons UP officials over incident,"The Allahabad High Court on Thursday sent out summons to top Uttar Pradesh officials over the alleged gang-rape and death of a Dalit woman. The Lucknow bench of the Allahabad High Court also took note, summoning the Uttar Pradesh additional chief secretary, director general of police and additional director general of police on October 12 in connection with the case. Justices Rajan Roy and Jaspreet Singh have also called the victim's parents to have their say in court that day. Taking suo moto cognisance of the case, which has triggered widespread outrage, the bench also ordered Hathras district magistrate and superintendent of police to appear with to apprise the court of various aspects of the case, including the ongoing probe into it. ""The incidents which took place after the death of the victim on September 29, 2020 leading up to her cremation, as alleged, have shocked our conscience. Therefore, we are taking suo moto cognizance of the same,"" the bench said in its order. The woman succumbed to the severe injuries she suffered when she was allegedly assaulted by four upper-caste men  later arrested -- in the fields at her village in Hathras district on September 14. She was cremated in Hathras in the dead of the night with family members saying they were not allowed to bring the body home one last time. But police claimed they had the family's consent for the cremation. Rahul, Priyanka arrested Meanwhile, Congress leaders Rahul Gandhi and Priyanka Gandhi were detained by UP police in Greater Noida, just outside Delhi, when they insisted on marching to Hathras to meet the family of the 19-year-old woman. The two leaders and about 150 party workers were held briefly and booked for violating prohibitory orders. They were let off after they furnished personal bonds. The melee on the Yamuna Expressway was the biggest among scattered protests during the day over the death of the woman, who the UP police controversially suggested was not a victim of rape. Party workers first gathered on the road on the Delhi-Noida border, dispersing only after the convoy of cars carrying Rahul Gandhi and Priyanka Gandhi Vadra passed them. The cars were stopped a few minutes later on the Yamuna Expressway by UP police. The Gandhis then insisted they will proceed on foot to Hathras, about 150 km away. Police tried to stop them again, citing prohibitory orders which prevent assembly of people. At one point, a video clip showed, Gandhi taking a fall amid the melee. He was quickly helped on his feet by his security personnel. Another clip showed him challenging a police offer. ""Can you tell me under which law you can stop me from marching towards Hathras?"" he said. ""I want to go alone to Hathras and on what basis can you arrest me?"" he said, arguing that this would not lead to any violation of section 144 of the CrPC. The leaders were later taken away in police cars, reportedly to the guesthouse at the International Buddh Circuit, before being released. Opposition outraged Bahujan Samaj Party chief Mayawati demanded that UP Chief Minister Yogi Adityanath should be replaced or President's rule imposed in the state. West Bengal Chief Minister Mamata Banerjee and Maharashtra CM Uddhav Thackeray also targeted the Uttar Pradesh government. ""Have no words to condemn the barbaric & shameful incident at Hathras involving a young Dalit girl. My deepest condolences to the family. More shameful is the forceful cremation without the family’s presence or consent, exposing those who use slogans & lofty promises for votes,"" Mamata tweeted. Thackeray, while addressing a virtual meeting, said that Hathras-like incidents won't be tolerated in Maharashtra and perpetrators of such crimes will be be severely punished. In Haryana, Dalit organisations and other outfits held protests in Kaithal, Yamunanagar, Fatehabad and Rohtak. Congress workers blocked an arterial road in Kolkata and held a candlelight protest in Hyderabad. BJP vs Congress spat As the events unfolded, Congress alleged that Gandhi was roughed up and other protesters faced lathis. ""Lala Lajpat Rai had said that every blow of a stick on my body would prove to be the last nail in the coffin of the British Raj. ""The sticks on Rahul ji and Priyanka ji's convoy will also prove to be the last nail in the coffin of the Yogi government,"" party spokesperson Randeep Surjewala said in a tweet in Hindi. UP minister Siddharth Nath Singh was dismissive of the ""photo op"", questioning even the fall suffered by Gandhi. The BJP also accused the Congress leaders of ignoring atrocities in the states ruled by that party. Uttar Pradesh Congress gave a call for a statewide protest on Friday against the detention of Rahul and Priyanka Gandhi. All district and city unit presidents were asked to hold immediate dharnas against the behaviour of the UP police which had detained the leaders."
5,/india/all-india/021020/odisha-cmo-pulls-out-who-report-on-coronavirus-situation-to-fight-opposition.html,Odisha CMO pulls out WHO report on coronavirus situation to fight Opposition,"BHUBANESWAR: As the Opposition upped its ante against the ruling in BJD in Odisha in the ongoing monsoon session of the Assembly, alleging “complete mismanagement” of the COVID-19 crisis, chief minister Naveen Patnaik put out on his official Twitter handle a World Health Organization (WHO) report that praised his government. The WHO report said the Odisha government effectively managed the COVID-19 pandemic situation. The Chief Minister’s Office (CMO) on its official Twitter handle posted the WHO article which read, “From Governance to Community Resilience: Odisha’s Response to COVID-19” which appeared in the WHO portal. The CMO made this article public on the day when the Opposition BJP and Congress came down heavily on the state government in the Assembly and accused it of failing to manage the COVID-19 pandemic situation. Both the parties alleged that the patients were dying due to improper and inadequate attention paid by the COVID-19 hospitals. They even said COVID-19 hospitals were fleecing money from the patients in different pretexts under the very nose of the health department officials. State health minister Nabakishore Das, however, refuted all the charges of the Opposition and said the state had earned accolades from WHO and many other agencies for its efficient Covid management. The CMO in a sticker attached to the Twitter post highlighted WHO’s points for which the state has earned praise. “They are early containment measures, dedicated Covid Hospitals, effective monitoring, telemedicine and plasma therapy, realtime information through state COVID dashboard, training of 1,80,000 health workers and financial incentives,” it said. The CMO also said that effective governance, robust health infrastructure, testing strategy, technology-aided pandemic management, migrant management, decentralised management through gram panchayats and involvement of Mission Shakti helped ineffective management of COVID-19. As of June 24, 2020, the state recorded an impressive recovery rate of 69.4 per cent, and the mortality rate of just 0.29 per cent, which is one of the best in the country. Odisha was the first in the country to initiate strict measures, the CMO mentioned. “The chief minister ordered an immediate closure of many public places on March 13, even though the state had not reported a single case of COVID-19,” the article dated September 17 said. It said that when the first case was reported on March 15, the state control rooms had been made operational, and capacity building of the district level health officials on preparedness and response activities, and public awareness campaigns on hand-washing and respiratory etiquettes were already initiated."
6,/india/crime/011020/hathras-woman-was-not-raped-confirms-forensic-report.html,"Hathras woman was not raped, confirms forensic report","Lucknow: senior Uttar Pradesh police officer said on Thursday said the forensic report has revealed that the 19-year-old Hathras woman who succumbed to her injuries at a Delhi hospital was not raped. Citing a forensic science laboratory (FSL) report, ADG (Law and Order) Prashant Kumar said the cause of her death is an injury on the neck and trauma resulting due to it. ""The report of the FSL has also come. It says clearly that samples did not have sperm. It makes clear that there was not rape or gang rape,"" Kumar said. ""Even the woman in her statement to police did not mention about rape but talked about 'marpeet' (beating) only, he said. ""For disturbing social harmony and create caste violence, some persons wrongly presented facts,"" the UP police officer said. ""Police took immediate action in the case and now we will identify those who tried to disturb social harmony and create caste violence,"" the ADG added, stressing that people ""distorted facts"" in the media."
7,/india/all-india/011020/no-threat-to-farmers-land-msp-will-be-hiked-continuously-in-coming-years-rajnath.html,MSP will be hiked continuously in coming years: Rajnath,"New Delhi: Seeking to allay concerns of farmers over a new set of legislations amid continuing protests by some parties, senior union minister Rajnath Singh on Thursday assured the farm community that the MSP (minimum support price) will not only stay, but it will also be continuously increased too in coming years. He also assured that no one can claim ownership of farmers' land in lieu of contract farming and said there are enough measures in the legislations to safeguard the interests of farmers. Opposition parties have alleged that farmers would be left at the mercy of corporates under the new laws, which have come into effect after the passage of three key bills in the recent monsoon session of Parliament. Hitting out at Congress and other opposition parties, Singh said they are trying to create misunderstandings about the farm bills passed by Parliament. He also attacked Congress for the burning of a tractor by protesters from their youth wing. ""A tractor was burnt. What is its logic? As weapons are sacred and respectable for soldiers, similarly tractors are to farmers. And I know this being a farmer, in any eventuality farmer will never burn his tractor. This was done by a political party for its political interest,"" he said. The Congress' youth wing activists on Monday had set a tractor ablaze near India Gate in the national capital, a few hundred metres from the Rashtrapati Bhavan and Parliament, to protest the contentious farm laws. Talking to a select group of journalists, the Defence Minister said, ""Being a farmer's son myself, I want to make it clear that the Modi government will never do anything that is not in the interest of farmers. And these agriculture-related bills are for economic and social empowerment of farmers."" Singh also accused the Opposition of creating a misunderstanding among people about the minimum support price (MSP) mechanism and the mandi system and categorically said that both will stay. ""I want to assure farmers that the MSP will stay and rather it will be continuously increased in the coming years, in any case, it will not be abolished,"" he said adding that MSP in oilseeds and pulses increased by 23 times during the BJP-led NDA government. On amendment in the APMC Act, Rajnath said the government is not ending the mandi system and rather it is giving more options to farmers to sell their produce including at more mandis. He also said that at times farmers were charged taxes and did not get the right MSP in mandis, but the new law will provide them more options to sell their produce. Talking about contract farming, Singh said enough provisions have been made in the new law to safeguard the interests of farmers. Farmers will get the price of their produce as decided by them in the contract,  and sufficient provisions have been incorporated to ensure that the price does not go below the contracted rate, he said. Singh further said if prices of their produce rise at a later stage, farmers will also get proportionately higher payments. Accusing the Opposition of creating misapprehensions about the new law that it poses a threat to farmers' land, Singh said, ""No power, in any case, can claim ownership of farmers' land using this bill. Enough measures have been made to safeguard the interests of farmers."" Underlining that all agriculture-related legislations are meant for the social and economic empowerment of farmers, Singh appealed to farmers and their organisation to come and talk to him to clear any misgivings. ""I appeal to all farmers' organisations that if they have any issue please come and talk with us. We are ready to listen to their suggestions for the welfare of farmers. I have already started talking to farmers organisations to clear misgivings and misconceptions,"" he said. The government has been under attack from the Opposition for the passage of three farms bill in the recently held monsoon session of Parliament. The government presented these bills as pro-farmers, saying these will ensure that farmers get better prices for their produce and do not get subjected to regulations of 'mandis'. It has also said that farmers will be now free to sell their produce to anyone and these legislations will increase competition and promote private investment, which will help in the development of farm infrastructure and generate employment. However, opposition parties have slammed the bills as ""anti-farmers"", claiming that the agriculture sector will be left to the fate of corporate interests. President Ram Nath Kovind has already given assent to the three farm bills -- The Farmers'' Produce Trade and Commerce (Promotion and Facilitation) Bill, 2020, The Farmers (Empowerment and Protection) Agreement of Price Assurance and Farm Services Bill, 2020 and The Essential Commodities (Amendment) Bill, 2020."
